Event ID 	 Event type 	 Covered text 	 combinedName 	 Paper ID 	 sentence 	 CL 	 Uncertainty
E2	Activation	activate	positive_ProtModification__RAF1______MAP2K2_E2	/tmp/positive_ProtModification__RAF1______MAP2K2.txt	positive ProtModification: RAF1 --+> MAP2K2 :  Interestingly, A-Raf does not activate MEK2, although c-Raf can activate both MEK1 and MEK2.	false	Certain
E3	Catalysis	regulator	positive_ProtModification__RAF1______MAP2K2_E3	/tmp/positive_ProtModification__RAF1______MAP2K2.txt	Raf-1, a direct regulator of MKK1 and MKK2, was activated under these conditions, and a synergistic activation of MKK was observed upon coexpression of Raf-1 and MKP-1.	false	Certain
E4	Activation	activation	positive_ProtModification__RAF1______MAP2K2_E4	/tmp/positive_ProtModification__RAF1______MAP2K2.txt	PD 098059 inhibited the activation of MAPKK2 by Raf with a much higher IC50 value (50 microM) and did not inhibit the phosphorylation of other Raf or MEK kinase substrates, indicating that it exerts its effect by binding to the inactive form of MAPKK1.	false	Certain
E5	Positive_regulation	activation	positive_ProtModification__RAF1______MAP2K2_E5	/tmp/positive_ProtModification__RAF1______MAP2K2.txt	PD 098059 inhibited the activation of MAPKK2 by Raf with a much higher IC50 value (50 microM) and did not inhibit the phosphorylation of other Raf or MEK kinase substrates, indicating that it exerts its effect by binding to the inactive form of MAPKK1.	false	Certain
E6	Phosphorylation	phosphorylates	positive_ProtModification__RAF1______MAP2K2_E6	/tmp/positive_ProtModification__RAF1______MAP2K2.txt	Raf phosphorylates and activates MEK1/MEK2 (31, 32).	false	Certain
E7	Phosphorylation	phosphorylated	positive_ProtModification__RAF1______MAP2K2_E7	/tmp/positive_ProtModification__RAF1______MAP2K2.txt	Furthermore, we show that the M. artiellia recombinant MEK-2 protein can phosphorylate and activate the M. artiellia recombinant MPK-1 and the recombinant MEK-2 itself can be phosphorylated and activated by immunoprecipitated mammalian Raf.	false	Uncertain
E1	Binding	binds	positive_DirectRegulation__GRB2______SOS1_E1	/tmp/positive_DirectRegulation__GRB2______SOS1.txt	positive DirectRegulation: GRB2 --+> SOS1 :  Buday et al.(21) also showed that Grb2-SH2 binds p36 and hSos1.	false	Certain
E7	Positive_regulation	overcome negative regulation	positive_DirectRegulation__GRB2______SOS1_E7	/tmp/positive_DirectRegulation__GRB2______SOS1.txt	These data argue against a role for Grb2 in the direct recruitment of Sos proteins to the plasma membrane and suggest that Grb2 may function to overcome negative regulation of Sos by its C terminus.	false	Certain
E2	Binding	interacted	positive_DirectRegulation__GRB2______SOS1_E2	/tmp/positive_DirectRegulation__GRB2______SOS1.txt	The hSos1 interacted with growth factor receptor-bound protein 2 (GRB2) in vivo and in vitro.	false	Certain
E3	Binding	binds	positive_DirectRegulation__GRB2______SOS1_E3	/tmp/positive_DirectRegulation__GRB2______SOS1.txt	Furthermore, Grb2 binds Sos1, and Sos1 is known to bind to Rac1 and activate it ( 32 ).	false	Certain
E4	Binding	interacts	positive_DirectRegulation__GRB2______SOS1_E4	/tmp/positive_DirectRegulation__GRB2______SOS1.txt	Sos-1 interacts with the SH3-containing adaptor molecule Grb2.	false	Certain
E5	Binding	binding	positive_DirectRegulation__GRB2______SOS1_E5	/tmp/positive_DirectRegulation__GRB2______SOS1.txt	We find that following EGF stimulation, the Sos1 protein associated with the EGFR is markedly less phosphorylated than the majority of the Sos1 within the cell and there was reduced binding of Grb2 with phosphorylated Sos1 protein in a direct binding assay.	false	Certain
E6	Binding	binding	positive_DirectRegulation__GRB2______SOS1_E6	/tmp/positive_DirectRegulation__GRB2______SOS1.txt	Phosphorylation of mSos1 did not affect binding of Grb2 to mSos1, but appeared to decrease binding of the mSos1-Grb2 complex to Shc and the EGF-receptor.	false	Certain
E1	Phosphorylation	phosphorylates	positive_ProtModification__JAK2______STAT3_E1	/tmp/positive_ProtModification__JAK2______STAT3.txt	positive ProtModification: JAK2 --+> STAT3 :  LEPRb activates JAK2 that subsequently phosphorylates and activates STAT3.	false	Certain
E2	Activation	activates	positive_ProtModification__JAK2______STAT3_E2	/tmp/positive_ProtModification__JAK2______STAT3.txt	positive ProtModification: JAK2 --+> STAT3 :  LEPRb activates JAK2 that subsequently phosphorylates and activates STAT3.	false	Certain
E3	Phosphorylation	phosphorylated	positive_ProtModification__JAK2______STAT3_E3	/tmp/positive_ProtModification__JAK2______STAT3.txt	STAT3 was phosphorylated by the tyrosine kinase Jak2 that was recruited to the alpha7 subunit of the nicotinic acetylcholine receptor.	false	Certain
E4	Positive_regulation	dependent	positive_ProtModification__JAK2______STAT3_E4	/tmp/positive_ProtModification__JAK2______STAT3.txt	G-Gly stimulated JAK2 phosphorylation and kinase activity and JAK2-dependent STAT3 phosphorylation and transcriptional activity.	false	Certain
E5	Phosphorylation	phosphorylation	positive_ProtModification__JAK2______STAT3_E5	/tmp/positive_ProtModification__JAK2______STAT3.txt	G-Gly stimulated JAK2 phosphorylation and kinase activity and JAK2-dependent STAT3 phosphorylation and transcriptional activity.	false	Uncertain
E6	Regulation	phosphorylate	positive_ProtModification__JAK2______STAT3_E6	/tmp/positive_ProtModification__JAK2______STAT3.txt	The PSD fraction also had a janus kinase 2 (Jak2)-like molecule, Jak2, believed to phosphorylate Stat3.	false	Certain
E7	Phosphorylation	phosphorylates	positive_ProtModification__JAK2______STAT3_E7	/tmp/positive_ProtModification__JAK2______STAT3.txt	JAK2 also phosphorylates LEPRb, STAT3, and multiple other downstream molecules.	false	Certain
E1	Regulation	regulation	positive_DirectRegulation__JAK2______PI3K_E1	/tmp/positive_DirectRegulation__JAK2______PI3K.txt	positive DirectRegulation: JAK2 --+> PI3K :  Furthermore, we found that both Src and JAK2 were necessary to PI3K regulation by this peptide.	false	Certain
E2	Regulation	interact	positive_DirectRegulation__JAK2______PI3K_E2	/tmp/positive_DirectRegulation__JAK2______PI3K.txt	AG490, on the other hand, is a tyrphostin tyrosine kinase inhibitor, which presumably would only block the substrate binding site and perhaps not affect the ability of Jak2 to interact with PI3K.	false	Certain
E1	Gene_expression	expression	Expression__Doxorubicin______BIRC5_E1	/tmp/Expression__Doxorubicin______BIRC5.txt	Expression: Doxorubicin ---> BIRC5 :  Treatments with adriamycin and taxol increase survivin expression in cancer cells (8).	false	Certain
E2	Gene_expression	expression	Expression__Doxorubicin______BIRC5_E2	/tmp/Expression__Doxorubicin______BIRC5.txt	The apoptotic rate of ASODN-treated cells was much higher than that of the control cells. survivin protein expression showed no significant variation between cells treated with liposome, adriamycin, SODN, and SODN+adriamycin (P>0.05), whereas compared with these 4 groups, cells treated with 400 ng/ml ASODN and 400 ng/ml ASODN+adriamycin had significantly lowered survivin mRNA expression (P<0.05), without significant differences between the latter two groups (P>0.05).	false	Certain
E3	Gene_expression	expression	Expression__Doxorubicin______BIRC5_E3	/tmp/Expression__Doxorubicin______BIRC5.txt	The apoptotic rate of ASODN-treated cells was much higher than that of the control cells. survivin protein expression showed no significant variation between cells treated with liposome, adriamycin, SODN, and SODN+adriamycin (P>0.05), whereas compared with these 4 groups, cells treated with 400 ng/ml ASODN and 400 ng/ml ASODN+adriamycin had significantly lowered survivin mRNA expression (P<0.05), without significant differences between the latter two groups (P>0.05).	false	Certain
E4	Regulation	regulates	Expression__Doxorubicin______BIRC5_E4	/tmp/Expression__Doxorubicin______BIRC5.txt	We and others have previously demonstrated that the cancer therapeutic drug doxorubicin down-regulates survivin expression by a transcriptional mechanism (31-33).	false	Certain
E5	Gene_expression	expression	Expression__Doxorubicin______BIRC5_E5	/tmp/Expression__Doxorubicin______BIRC5.txt	We and others have previously demonstrated that the cancer therapeutic drug doxorubicin down-regulates survivin expression by a transcriptional mechanism (31-33).	false	Certain
E6	Gene_expression	expression	Expression__Doxorubicin______BIRC5_E6	/tmp/Expression__Doxorubicin______BIRC5.txt	For example, treatments with adriamycin and taxol increased survivin expression in MCF-7 cells (3).	false	Certain
E9	Negative_regulation	down-regulation	Expression__Doxorubicin______BIRC5_E9	/tmp/Expression__Doxorubicin______BIRC5.txt	Doxorubicin treatment results in down-regulation of Survivin protein levels only in parental CaCl cells, which contain functional p53.	false	Certain
E7	Positive_regulation	increased	Expression__Doxorubicin______BIRC5_E7	/tmp/Expression__Doxorubicin______BIRC5.txt	Here, exposure of breast carcinoma MCF-7 or cervical carcinoma HeLa cells to anticancer agents, including Adriamycin, Taxol, or UVB resulted in a 4-5-fold increased survivin expression.	false	Certain
E8	Gene_expression	expression	Expression__Doxorubicin______BIRC5_E8	/tmp/Expression__Doxorubicin______BIRC5.txt	Here, exposure of breast carcinoma MCF-7 or cervical carcinoma HeLa cells to anticancer agents, including Adriamycin, Taxol, or UVB resulted in a 4-5-fold increased survivin expression.	false	Certain
E10	Gene_expression	expression	Expression__Doxorubicin______BIRC5_E10	/tmp/Expression__Doxorubicin______BIRC5.txt	Higher expression of survivin is induced by doxorubicin in QBC939.	false	Certain
E2	Phosphorylation	phosphorylates	positive_ProtModification__MAPK8______JUN_E2	/tmp/positive_ProtModification__MAPK8______JUN.txt	positive ProtModification: MAPK8 --+> JUN :  JNK phosphorylates c-Jun on Ser-63 and Ser-73, the result being induction of its transcriptional activity.	false	Certain
E3	Positive_regulation	enhanced	positive_ProtModification__MAPK8______JUN_E3	/tmp/positive_ProtModification__MAPK8______JUN.txt	In addition, testosterone significantly enhanced in vivo phosphorylation of c-jun by 4-HPR as well as JNK activation.	false	Certain
E7	Regulation	heterodimerization	positive_ProtModification__JAK1______JAK2_E7	/tmp/positive_ProtModification__JAK1______JAK2.txt	positive ProtModification: JAK1 --+> JAK2 :  The Levine laboratory reported that type I JAK2 inhibitors can induce a state of persistent JAK2 signaling in EPOR- or MPL-expressing myeloid cells that involves heterodimerization and trans-phosphorylation of JAK2 by JAK1 or TYK2 .	false	Certain
E2	Phosphorylation	phosphorylated	positive_ProtModification__JAK1______JAK2_E2	/tmp/positive_ProtModification__JAK1______JAK2.txt	Although both receptors result in an equivalent tyrosine phosphorylation of JAK1 (Fig. 5A, top panel), double tyrosine-phosphorylated and therefore activated JAK2 is better detectable when activating the murine receptor (Fig. 5A, bottom panel).	false	Certain
E3	Activation	activated	positive_ProtModification__JAK1______JAK2_E3	/tmp/positive_ProtModification__JAK1______JAK2.txt	Although both receptors result in an equivalent tyrosine phosphorylation of JAK1 (Fig. 5A, top panel), double tyrosine-phosphorylated and therefore activated JAK2 is better detectable when activating the murine receptor (Fig. 5A, bottom panel).	false	Certain
E4	Positive_regulation	activated	positive_ProtModification__JAK1______JAK2_E4	/tmp/positive_ProtModification__JAK1______JAK2.txt	Although both receptors result in an equivalent tyrosine phosphorylation of JAK1 (Fig. 5A, top panel), double tyrosine-phosphorylated and therefore activated JAK2 is better detectable when activating the murine receptor (Fig. 5A, bottom panel).	false	Certain
E6	Phosphorylation	phosphorylate	positive_ProtModification__JAK1______JAK2_E6	/tmp/positive_ProtModification__JAK1______JAK2.txt	Jak1 was found to equally phosphorylate the KN-Jak2 and KN-JH2Delta-Jak2 proteins (Fig. 7 B ).	false	Certain
E5	Negative_regulation	suppressed	positive_ProtModification__JAK1______JAK2_E5	/tmp/positive_ProtModification__JAK1______JAK2.txt	Finally, suppression of Jak1 by lentiviral delivery of Jak1 short hairpin RNA blocked PRL activation of ERK and signal transducer and activator of transcription 3 and suppressed PRL activation of Jak2, Stat5a, Stat5b, and Akt, as well as tyrosine phosphorylation of PRLR.	false	Certain
E1	Positive_regulation	inducing	positive_PromoterBinding__E2F1______CDKN2A_E1	/tmp/positive_PromoterBinding__E2F1______CDKN2A.txt	positive PromoterBinding: E2F1 --+> CDKN2A :  It has been proposed that the E2F1 transcription factor serves as a link between the Rb/E2F proliferation pathway and the p53 apoptosis pathway by inducing the expression of p19ARF, a protein that regulates p53 stability.	false	Certain
E2	Positive_regulation	activates	positive_PromoterBinding__E2F1______CDKN2A_E2	/tmp/positive_PromoterBinding__E2F1______CDKN2A.txt	It also has been reported previously that E2F-1 transcriptionally activates p14ARF expression (50).	false	Certain
E3	Gene_expression	expression	positive_PromoterBinding__E2F1______CDKN2A_E3	/tmp/positive_PromoterBinding__E2F1______CDKN2A.txt	It also has been reported previously that E2F-1 transcriptionally activates p14ARF expression (50).	false	Certain
E4	Positive_regulation	induced	positive_PromoterBinding__E2F1______CDKN2A_E4	/tmp/positive_PromoterBinding__E2F1______CDKN2A.txt	Activation of E2F1 induced p14ARF mRNA and protein levels.	false	Certain
E7	Transcription	mRNA	positive_PromoterBinding__E2F1______CDKN2A_E7	/tmp/positive_PromoterBinding__E2F1______CDKN2A.txt	Activation of E2F1 induced p14ARF mRNA and protein levels.	false	Certain
E5	Regulation	expression	positive_PromoterBinding__E2F1______CDKN2A_E5	/tmp/positive_PromoterBinding__E2F1______CDKN2A.txt	To further demonstrate the role of E2F-1 in controlling the expression of p14ARF, we performed Chromatin Immunoprecipitation analysis to assess the binding of E2F-1 to the p14ARF promoter.	false	Certain
E1	Activation	activation	positive_ProtModification__MAP2K2______MAPK1_E1	/tmp/positive_ProtModification__MAP2K2______MAPK1.txt	positive ProtModification: MAP2K2 --+> MAPK1 :  Whereas wild-type p70 slightly inhibited ERK2 activation by RAS and MEK2, co-expression or p70-DeltaC1 or p70-DeltaC2 with either protein stimulated ERK2 cooperatively.	false	Certain
E2	Positive_regulation	activation	positive_ProtModification__MAP2K2______MAPK1_E2	/tmp/positive_ProtModification__MAP2K2______MAPK1.txt	positive ProtModification: MAP2K2 --+> MAPK1 :  Whereas wild-type p70 slightly inhibited ERK2 activation by RAS and MEK2, co-expression or p70-DeltaC1 or p70-DeltaC2 with either protein stimulated ERK2 cooperatively.	false	Certain
E3	Activation	activators	positive_ProtModification__MAP2K2______MAPK1_E3	/tmp/positive_ProtModification__MAP2K2______MAPK1.txt	Indeed, MEK1 and MEK2 are the only known activators of ERK1 and ERK2.	false	Certain
E5	Positive_regulation	phosphorylating	positive_ProtModification__MAP2K2______MAPK1_E5	/tmp/positive_ProtModification__MAP2K2______MAPK1.txt	MEK1 and MEK2 are two isoforms of the kinase operating immediately upstream of ERK, and connecting Raf and ERK by phosphorylating ERK.	false	Certain
E4	Phosphorylation	phosphorylated	positive_ProtModification__MAP2K2______MAPK1_E4	/tmp/positive_ProtModification__MAP2K2______MAPK1.txt	Of the MEKs tested, only MEK1 and MEK2 phosphorylated ERK2.	false	Certain
E1	Binding	bound	DirectRegulation__BCL2______MCL1_E1	/tmp/DirectRegulation__BCL2______MCL1.txt	DirectRegulation: BCL2 ---> MCL1 :  Mcl-1 and A1 had no affinity for BadBH3, whereas Bcl-2, Bcl-xL, and Bcl-w bind BadBH3 avidly.(D) Conversely, only Mcl-1 and A1 bound tightly to NoxaBH3.	false	Certain
E2	Binding	interacted	DirectRegulation__BCL2______MCL1_E2	/tmp/DirectRegulation__BCL2______MCL1.txt	Bcl-2 also interacted with Bcl-X-L and Mcl-1 and with the dominant inhibitors Bax and Bcl-X-S.	false	Certain
E1	Negative_regulation	diminished	negative_DirectRegulation__dasatinib______STAT5A_E1	/tmp/negative_DirectRegulation__dasatinib______STAT5A.txt	negative DirectRegulation: dasatinib ---| STAT5A :  In addition, dasatinib diminished activity of STAT5, STAT3, AKT and ERK and attenuated the levels of c-KIT.	false	Certain
E2	Negative_regulation	diminished	negative_DirectRegulation__dasatinib______STAT5A_E2	/tmp/negative_DirectRegulation__dasatinib______STAT5A.txt	Moreover, dasatinib treatment diminished activity of STAT5, STAT3, AKT and ERK and attenuated the levels of c-KIT (evaluated CD34− cells only) and induced loss of viability of CD34− cells .	false	Certain
E4	Negative_regulation	inhibits	negative_DirectRegulation__dasatinib______STAT5A_E4	/tmp/negative_DirectRegulation__dasatinib______STAT5A.txt	In vitro, dasatinib inhibits STAT5 signaling and down-regulates the expression of STAT5 target genes, including BCL-X, MCL-1, and cyclin D1, resulting in the inhibition of cell proliferation and induction of apoptosis .	false	Certain
E5	Pathway	signaling	negative_DirectRegulation__dasatinib______STAT5A_E5	/tmp/negative_DirectRegulation__dasatinib______STAT5A.txt	In vitro, dasatinib inhibits STAT5 signaling and down-regulates the expression of STAT5 target genes, including BCL-X, MCL-1, and cyclin D1, resulting in the inhibition of cell proliferation and induction of apoptosis .	false	Certain
E1	Positive_regulation	induces	positive_Expression__Doxorubicin______TP53_E1	/tmp/positive_Expression__Doxorubicin______TP53.txt	positive Expression: Doxorubicin --+> TP53 :  The molecular mechanism underlying these toxicities are incompletely understood, but previous results have demonstrated that doxorubicin induces p53 expression.	false	Certain
E3	Gene_expression	expression	positive_Expression__Doxorubicin______TP53_E3	/tmp/positive_Expression__Doxorubicin______TP53.txt	positive Expression: Doxorubicin --+> TP53 :  The molecular mechanism underlying these toxicities are incompletely understood, but previous results have demonstrated that doxorubicin induces p53 expression.	false	Certain
E5	Positive_regulation	resulted	positive_Expression__Doxorubicin______TP53_E5	/tmp/positive_Expression__Doxorubicin______TP53.txt	Doxorubicin treatment resulted in increased p53 expression, without changes in Mitogen-activated protein kinase or p38 activity.	false	Certain
E6	Positive_regulation	increased	positive_Expression__Doxorubicin______TP53_E6	/tmp/positive_Expression__Doxorubicin______TP53.txt	Doxorubicin treatment resulted in increased p53 expression, without changes in Mitogen-activated protein kinase or p38 activity.	false	Certain
E7	Gene_expression	expression	positive_Expression__Doxorubicin______TP53_E7	/tmp/positive_Expression__Doxorubicin______TP53.txt	Doxorubicin treatment resulted in increased p53 expression, without changes in Mitogen-activated protein kinase or p38 activity.	false	Certain
E8	Gene_expression	expression	positive_Expression__Doxorubicin______TP53_E8	/tmp/positive_Expression__Doxorubicin______TP53.txt	In contrast to free doxorubicin, which is a strong inducer of p53 expression, increased p53 expression was never observed after the treatment with the polymeric drug.	false	Certain
E10	Positive_regulation	increased	positive_Expression__Doxorubicin______TP53_E10	/tmp/positive_Expression__Doxorubicin______TP53.txt	UV irradiation, bleomycin, and doxorubicin increased wild-type p53 expression and decreased MAP4 expression. doxorubicin treatment led to an upregulation of p53 protein levels, which was preceded by elevated levels of phosphorylated p53 at Ser15.	false	Certain
E11	Gene_expression	expression	positive_Expression__Doxorubicin______TP53_E11	/tmp/positive_Expression__Doxorubicin______TP53.txt	UV irradiation, bleomycin, and doxorubicin increased wild-type p53 expression and decreased MAP4 expression. doxorubicin treatment led to an upregulation of p53 protein levels, which was preceded by elevated levels of phosphorylated p53 at Ser15.	false	Certain
E12	Positive_regulation	led	positive_Expression__Doxorubicin______TP53_E12	/tmp/positive_Expression__Doxorubicin______TP53.txt	UV irradiation, bleomycin, and doxorubicin increased wild-type p53 expression and decreased MAP4 expression. doxorubicin treatment led to an upregulation of p53 protein levels, which was preceded by elevated levels of phosphorylated p53 at Ser15.	false	Certain
E13	Positive_regulation	resulted	positive_Expression__Doxorubicin______TP53_E13	/tmp/positive_Expression__Doxorubicin______TP53.txt	Doxorubicin treatment resulted in the induction of p53 mRNA in the Wild-type cells, but not the Y8 cells.	false	Certain
E9	Regulation	enhance	positive_Expression__Doxorubicin______TP53_E9	/tmp/positive_Expression__Doxorubicin______TP53.txt	It is well known that DNA-damaging agents such as doxorubicin enhance the expression of p53.	false	Certain
E1	Activation	activate	positive_ProtModification__JAK1______STAT1_E1	/tmp/positive_ProtModification__JAK1______STAT1.txt	positive ProtModification: JAK1 --+> STAT1 :  Finally, in other cell types the correlation between JAK1 activation and the induction of STAT1 has suggested that JAK1 may activate STAT1.	false	Uncertain
E2	Positive_regulation	activate	positive_ProtModification__JAK1______STAT1_E2	/tmp/positive_ProtModification__JAK1______STAT1.txt	positive ProtModification: JAK1 --+> STAT1 :  Finally, in other cell types the correlation between JAK1 activation and the induction of STAT1 has suggested that JAK1 may activate STAT1.	false	Uncertain
E3	Activation	activation	positive_ProtModification__JAK1______STAT1_E3	/tmp/positive_ProtModification__JAK1______STAT1.txt	One is the JAK1/2-dependent PLC-gamma pathway inducing the activations of PKCalpha, c-Src, and STAT1, and the other is the direct activation of STAT1 by JAK1/2.	false	Certain
E4	Positive_regulation	activation	positive_ProtModification__JAK1______STAT1_E4	/tmp/positive_ProtModification__JAK1______STAT1.txt	One is the JAK1/2-dependent PLC-gamma pathway inducing the activations of PKCalpha, c-Src, and STAT1, and the other is the direct activation of STAT1 by JAK1/2.	false	Certain
E5	Regulation	involved	positive_ProtModification__JAK1______STAT1_E5	/tmp/positive_ProtModification__JAK1______STAT1.txt	Cytoplasmic nonreceptor tyrosine kinases Jak1 and Jak2 may be involved in the activation of stat91 and other transcription factors in EGF and IFN-gamma signaling pathways.	false	Uncertain
E7	Activation	activation	positive_ProtModification__JAK1______STAT1_E7	/tmp/positive_ProtModification__JAK1______STAT1.txt	IFN-alpha binding initiated phosphorylation of Jak1 and Tyk2 kinases leading to Stat1/Stat2 activation, nuclear translocation, and transactivation of an ISRE-luciferase reporter gene construct.	false	Certain
E8	Positive_regulation	activation	positive_ProtModification__JAK1______STAT1_E8	/tmp/positive_ProtModification__JAK1______STAT1.txt	IFN-alpha binding initiated phosphorylation of Jak1 and Tyk2 kinases leading to Stat1/Stat2 activation, nuclear translocation, and transactivation of an ISRE-luciferase reporter gene construct.	false	Certain
E9	Phosphorylation	phosphorylation	positive_ProtModification__JAK1______STAT1_E9	/tmp/positive_ProtModification__JAK1______STAT1.txt	Upon clustering of uPA.uPAR complex by a monoclonal antibody, JAK1 associates with uPAR, which in turn leads to STAT1 phosphorylation, dimerization, specific binding to DNA, and gene activation.	false	Certain
E6	Phosphorylation	phosphorylates	positive_ProtModification__JAK1______STAT1_E6	/tmp/positive_ProtModification__JAK1______STAT1.txt	In addition, the Janus kinase family member Jak1 efficiently phosphorylates Stat1 but not Stat3 in Sf-9 cells.	false	Certain
E1	Gene_expression	expression	positive_PromoterBinding__MYC______E2F1_E1	/tmp/positive_PromoterBinding__MYC______E2F1.txt	positive PromoterBinding: MYC --+> E2F1 :  The first positive self-feedback loop is through the concomitant induction of expression between E2F-1 and c-MYC proteins where each transcription factor has been proved to induce the expression of the other , as E2F1 promoter contains c-MYC responsive element through which E2F-1 protein expression is induced .	false	Certain
E3	Positive_regulation	activates	positive_PromoterBinding__MYC______E2F1_E3	/tmp/positive_PromoterBinding__MYC______E2F1.txt	These findings expand the known classes of transcripts within the c-Myc target gene network, and reveal a mechanism through which c-Myc simultaneously activates E2F1 transcription and limits its translation, allowing a tightly controlled proliferative signal.	false	Certain
E4	Transcription	transcription	positive_PromoterBinding__MYC______E2F1_E4	/tmp/positive_PromoterBinding__MYC______E2F1.txt	These findings expand the known classes of transcripts within the c-Myc target gene network, and reveal a mechanism through which c-Myc simultaneously activates E2F1 transcription and limits its translation, allowing a tightly controlled proliferative signal.	false	Certain
E6	Positive_regulation	induces	positive_PromoterBinding__MYC______E2F1_E6	/tmp/positive_PromoterBinding__MYC______E2F1.txt	E2F-1, c-MYC, and miR-17-5p is a triad of two regulatory loops: a negative and a positive loop, where c-MYC induces the expression of E2F-1 that induces the expression of miR-17-5p which in turn reverses the expression of E2F-1 to close the loop.	false	Certain
E5	Positive_regulation	induces	positive_PromoterBinding__MYC______E2F1_E5	/tmp/positive_PromoterBinding__MYC______E2F1.txt	Restoration of c-Myc in non-adherent cells induces the expression of E2F-1, and hyperphosphorylation of pRb in response to EGF treatment.	false	Certain
