Event ID 	 Event type 	 Covered text 	 combinedName 	 Paper ID 	 sentence 	 CL 	 Uncertainty
E5	Phosphorylation	phosphorylation	positive_ProtModification__TORC1______RPS6KB1_E5	/tmp/positive_ProtModification__TORC1______RPS6KB1.txt	The data presented here suggest that phosphorylation of S6K1 and 4EBP1 by mTORC1 decreases largely after suppression of ASCT2 protein levels (Figs. 1 and 2).	false	Certain
E7	Phosphorylation	phosphorylates	positive_ProtModification__TORC1______RPS6KB1_E7	/tmp/positive_ProtModification__TORC1______RPS6KB1.txt	mTORC1 (mammalian TORC1) phosphorylates and activates S6K1 and S6K2, whose first identified substrate was rpS6 (ribosomal protein S6), a component of the 40S ribosome.	false	Certain
E11	Phosphorylation	phosphorylates	positive_ProtModification__TORC1______RPS6KB1_E11	/tmp/positive_ProtModification__TORC1______RPS6KB1.txt	mTOR complex 1 phosphorylates S6K1, while mTORC2 phosphorylates Akt.	false	Certain
E1	Phosphorylation	phosphorylates	positive_ProtModification__AKT1______MDM2_E1	/tmp/positive_ProtModification__AKT1______MDM2.txt	positive ProtModification: AKT1 --+> MDM2 :  Previous studies have shown that Akt phosphorylates and stabilizes MDM2.	false	Certain
E6	Phosphorylation	phosphorylating	positive_ProtModification__AKT1______MDM2_E6	/tmp/positive_ProtModification__AKT1______MDM2.txt	Phosphorylated Akt can indirectly hinder p53-dependent growth suppression and apoptosis by phosphorylating Mdm2.	false	Certain
E2	Activation	activated	positive_ProtModification__AKT1______MDM2_E2	/tmp/positive_ProtModification__AKT1______MDM2.txt	Mdm2 is activated by phospho-Akt, and we previously showed that RSV activates Akt and delays apoptosis in primary human airway epithelial cells.	false	Certain
E3	Positive_regulation	activated	positive_ProtModification__AKT1______MDM2_E3	/tmp/positive_ProtModification__AKT1______MDM2.txt	Mdm2 is activated by phospho-Akt, and we previously showed that RSV activates Akt and delays apoptosis in primary human airway epithelial cells.	false	Certain
E5	Positive_regulation	phosphorylation	positive_ProtModification__AKT1______MDM2_E5	/tmp/positive_ProtModification__AKT1______MDM2.txt	Furthermore, we demonstrate that the E3 ligase activity of Mdm2 and phosphorylation of Mdm2 by Akt are essential for Mdm2 to affect androgen receptor ubiquitylation and degradation.	false	Certain
E4	Regulation	decreased	positive_ProtModification__AKT1______MDM2_E4	/tmp/positive_ProtModification__AKT1______MDM2.txt	Knockdown of Akt decreased Hdm2 phosphorylation, increased p53 level and potentiated TRAIL-induced cell death.	false	Certain
E1	Transcription	transcription	positive_PromoterBinding__STAT5B______BCL2L1_E1	/tmp/positive_PromoterBinding__STAT5B______BCL2L1.txt	positive PromoterBinding: STAT5B --+> BCL2L1 :  This result suggests that hormone-dependent selective recruitment of STAT5B to P4 region could be involved in the hormonal repression of bcl-X transcription.	false	Certain
E2	Regulation	decreased	positive_PromoterBinding__STAT5B______BCL2L1_E2	/tmp/positive_PromoterBinding__STAT5B______BCL2L1.txt	Inhibition of either expression or activity of RELA and STAT5B decreased Bcl-xL expression levels and increased carboplatin sensitivity in carbo-platin-resistant ovarian cancer cells.	false	Certain
E1	Phosphorylation	phosphorylates	negative_ProtModification__AKT1______FOXO1_E1	/tmp/negative_ProtModification__AKT1______FOXO1.txt	negative ProtModification: AKT1 ---| FOXO1 :  Akt phosphorylates pro-apoptotic proteins such as Bad and FoxO1 and inhibits the pro-apoptotic functions of these proteins.	false	Certain
E2	Phosphorylation	phosphorylation	negative_ProtModification__AKT1______FOXO1_E2	/tmp/negative_ProtModification__AKT1______FOXO1.txt	PROF is a mediator that facilitates FOXO1 phosphorylation by phospho-Akt.	false	Certain
E5	Phosphorylation	phosphorylation	negative_ProtModification__AKT1______FOXO1_E5	/tmp/negative_ProtModification__AKT1______FOXO1.txt	Thus, ProF modulates Foxo1 phosphorylation by Akt, promoting adipocyte differentiation.	false	Certain
E6	Phosphorylation	phosphorylate	negative_ProtModification__AKT1______FOXO1_E6	/tmp/negative_ProtModification__AKT1______FOXO1.txt	Akt can phosphorylate FKHR in vitro on three phosphoacceptor sites, at least a subset of which can also be phosphorylated by Akt in vivo.	false	Certain
E7	Phosphorylation	phosphorylated	negative_ProtModification__AKT1______FOXO1_E7	/tmp/negative_ProtModification__AKT1______FOXO1.txt	Akt can phosphorylate FKHR in vitro on three phosphoacceptor sites, at least a subset of which can also be phosphorylated by Akt in vivo.	false	Certain
E8	Phosphorylation	phosphorylates	negative_ProtModification__AKT1______FOXO1_E8	/tmp/negative_ProtModification__AKT1______FOXO1.txt	AKT phosphorylates and inactivates FOXO1 by relocating it to the cytoplasm.	false	Certain
E9	Inactivation	inactivates	negative_ProtModification__AKT1______FOXO1_E9	/tmp/negative_ProtModification__AKT1______FOXO1.txt	AKT phosphorylates and inactivates FOXO1 by relocating it to the cytoplasm.	false	Certain
E1	Gene_expression	expression	Expression__methotrexate______BCL2_E1	/tmp/Expression__methotrexate______BCL2.txt	Expression: methotrexate ---> BCL2 :  Methotrexate in lower concentrations induces apoptosis of human choriocarcinoma cells via mitochondrial-initiated pathways, including reduction of mitochondrial membrane potential, activation of caspase-9, and up-regulation of Bax/Bcl-2 expression.	false	Certain
E2	Gene_expression	expression	Expression__methotrexate______BCL2_E2	/tmp/Expression__methotrexate______BCL2.txt	A significant decrease in enterocyte apoptosis in the ileum of methotrexate-glutamine rats (vs. methotrexate) was accompanied by decreased Bax and increased Bcl-2 mRNA expression.	false	Certain
E3	Gene_expression	expression	Expression__methotrexate______BCL2_E3	/tmp/Expression__methotrexate______BCL2.txt	Topotecan and methotrexate alter expression of the apoptosis-related genes BCL2, FAS and BCL2L12 in leukemic HL-60 cells.	false	Certain
E1	Positive_regulation	requires	positive_DirectRegulation__Ras______RAF1_E1	/tmp/positive_DirectRegulation__Ras______RAF1.txt	positive DirectRegulation: Ras --+> RAF1 :  Full activation of Raf-1 requires the interaction of its CRD with Ras.	false	Certain
E3	Activation	activation	positive_DirectRegulation__Ras______RAF1_E3	/tmp/positive_DirectRegulation__Ras______RAF1.txt	A dominant negative mutant of Rac or RhoA can block Raf activation by Ras.	false	Certain
E4	Positive_regulation	activation	positive_DirectRegulation__Ras______RAF1_E4	/tmp/positive_DirectRegulation__Ras______RAF1.txt	A dominant negative mutant of Rac or RhoA can block Raf activation by Ras.	false	Certain
E5	Binding	interact	positive_DirectRegulation__Ras______RAF1_E5	/tmp/positive_DirectRegulation__Ras______RAF1.txt	In addition to this domain, the cysteine-rich domain (CRD) of Raf-1 was recently found to interact with Ras ( 5 , 6 ).	false	Certain
E6	Activation	activated	positive_DirectRegulation__Ras______RAF1_E6	/tmp/positive_DirectRegulation__Ras______RAF1.txt	Raf-1 is activated by Ras, which in turn is activated by the GTP-GDP exchange factor SOS ( 4 , 48 ).	false	Certain
E7	Positive_regulation	activated	positive_DirectRegulation__Ras______RAF1_E7	/tmp/positive_DirectRegulation__Ras______RAF1.txt	Raf-1 is activated by Ras, which in turn is activated by the GTP-GDP exchange factor SOS ( 4 , 48 ).	false	Certain
E8	Binding	associate	positive_DirectRegulation__Ras______RAF1_E8	/tmp/positive_DirectRegulation__Ras______RAF1.txt	Recent studies have revealed that Ras can associate physically with Raf.	false	Certain
E9	Positive_regulation	promote	positive_DirectRegulation__Ras______RAF1_E9	/tmp/positive_DirectRegulation__Ras______RAF1.txt	It has been suspected that dimeric Ras may promote dimerization and activation of Raf.	false	Uncertain
E11	Regulation	target	positive_DirectRegulation__Ras______RAF1_E11	/tmp/positive_DirectRegulation__Ras______RAF1.txt	The ras protein may still be required to target Raf to the membrane, however, to allow phosphorylation by PKC ( 54 ).	false	Certain
E12	Positive_regulation	stimulates	positive_DirectRegulation__Ras______RAF1_E12	/tmp/positive_DirectRegulation__Ras______RAF1.txt	Activation of Ras stimulates Raf, which then activates MEK , followed by the activation of ERK .	false	Certain
E15	Binding	Binding	positive_DirectRegulation__Ras______RAF1_E15	/tmp/positive_DirectRegulation__Ras______RAF1.txt	Binding of Ras to c-Raf-1 is a pivotal step of many mitogenic signalling pathways.	false	Certain
E17	Binding	interaction	positive_DirectRegulation__Ras______RAF1_E17	/tmp/positive_DirectRegulation__Ras______RAF1.txt	Previous workers have shown that there is no interaction between Raf and Ras in the presence of GDP.	false	Certain
E18	Positive_regulation	activation	positive_DirectRegulation__Ras______RAF1_E18	/tmp/positive_DirectRegulation__Ras______RAF1.txt	The mechanism of Ras-induced Raf-1 activation is not fully understood.	false	Certain
E19	Activation	activation	positive_DirectRegulation__Ras______RAF1_E19	/tmp/positive_DirectRegulation__Ras______RAF1.txt	The mechanism of Ras-induced Raf-1 activation is not fully understood.	false	Certain
E20	Positive_regulation	leads	positive_DirectRegulation__Ras______RAF1_E20	/tmp/positive_DirectRegulation__Ras______RAF1.txt	This activation of Ras leads to activation of Raf.	false	Certain
E24	Positive_regulation	stimulates	positive_DirectRegulation__Ras______RAF1_E24	/tmp/positive_DirectRegulation__Ras______RAF1.txt	When activated, Ras in turn stimulates the Raf-MEK-ERK and PI 3-kinase pathways ( 34 ).	false	Certain
E25	Binding	bind	positive_DirectRegulation__Ras______RAF1_E25	/tmp/positive_DirectRegulation__Ras______RAF1.txt	The Ras and Rap1A proteins can bind to the Raf and RalGDS families.	false	Certain
E26	Activation	activation	positive_DirectRegulation__Ras______RAF1_E26	/tmp/positive_DirectRegulation__Ras______RAF1.txt	The membrane targeting and activation of C-Raf by Ras needs prohibitin in vivo.	false	Certain
E27	Positive_regulation	activation	positive_DirectRegulation__Ras______RAF1_E27	/tmp/positive_DirectRegulation__Ras______RAF1.txt	The membrane targeting and activation of C-Raf by Ras needs prohibitin in vivo.	false	Certain
E29	Binding	interact	positive_DirectRegulation__Ras______RAF1_E29	/tmp/positive_DirectRegulation__Ras______RAF1.txt	Raf Binding Ras was found to interact with Raf in a GTP-dependent manner ( 4 , 5 , 6 , 7 , 8 , 9 ) .	false	Certain
E1	Regulation	regulated	negative_PromoterBinding__RB1______E2F1_E1	/tmp/negative_PromoterBinding__RB1______E2F1.txt	negative PromoterBinding: RB1 ---| E2F1 :  E2F1 transcription function is regulated by interaction with hypophosphorylated pRb. retinoblastoma protein is recruited to the PAX8-binding site, and is involved in PAX8-mediated E2F1 transcription in cancer cells.	false	Certain
E2	Transcription	transcription	negative_PromoterBinding__RB1______E2F1_E2	/tmp/negative_PromoterBinding__RB1______E2F1.txt	negative PromoterBinding: RB1 ---| E2F1 :  E2F1 transcription function is regulated by interaction with hypophosphorylated pRb. retinoblastoma protein is recruited to the PAX8-binding site, and is involved in PAX8-mediated E2F1 transcription in cancer cells.	false	Certain
E1	Gene_expression	expression	positive_Expression__Cytoxan______BAX_E1	/tmp/positive_Expression__Cytoxan______BAX.txt	positive Expression: Cytoxan --+> BAX :  Bax expression was increased in the combined antagonist + cyclophosphamide, and antagonist only mice (groups 2 and 4).	false	Certain
E2	Transcription	transcription	positive_PromoterBinding__E2F1______MYC_E2	/tmp/positive_PromoterBinding__E2F1______MYC.txt	positive PromoterBinding: E2F1 --+> MYC :  In summary, these studies established that in myeloid cells: (1) v-Abl binds retinoblastoma resulting in increased E2F-1-driven c-myc transcription, and (2) an alternative pathway exists for TGF-beta1-mediated growth inhibition of v-Abl-transformed cells, in which increased rather than decreased E2F-mediated c-myc transcription is observed.	false	Certain
E3	Transcription	transcription	positive_PromoterBinding__E2F1______MYC_E3	/tmp/positive_PromoterBinding__E2F1______MYC.txt	positive PromoterBinding: E2F1 --+> MYC :  In summary, these studies established that in myeloid cells: (1) v-Abl binds retinoblastoma resulting in increased E2F-1-driven c-myc transcription, and (2) an alternative pathway exists for TGF-beta1-mediated growth inhibition of v-Abl-transformed cells, in which increased rather than decreased E2F-mediated c-myc transcription is observed.	false	Certain
E1	Binding	bound	positive_PromoterBinding__E2F1______MYC_E1	/tmp/positive_PromoterBinding__E2F1______MYC.txt	At the transcriptional level, the c-Myc promoter is potentially bound by several transcriptional factors, such as TCF4, LEF-1, β-catenin, γ-Catenin, E2F-1, p53 and NFκB.	false	Uncertain
E6	Transcription	transcription	positive_PromoterBinding__E2F1______MYC_E6	/tmp/positive_PromoterBinding__E2F1______MYC.txt	It has been reported that Ets-1 transactivates c-myc transcription at an E2F-1/Ets binding site located at position -68 of the c-myc promoter and that ETS proteins including Ets-1 and PU.1 share similar DNA binding domains (Roussel et al., 1994).	false	Certain
E10	Binding	occupied	positive_PromoterBinding__E2F1______MYC_E10	/tmp/positive_PromoterBinding__E2F1______MYC.txt	For example, in proliferating myeloid cells where the c-Myc gene is expressed, the c-Myc promoter is occupied by the activators E2F1 and Ets2 (21).	false	Certain
E15	Positive_regulation	transactivates	positive_PromoterBinding__E2F1______MYC_E15	/tmp/positive_PromoterBinding__E2F1______MYC.txt	Previous studies have shown that E2f1 transactivates the cMyc promoter through E2f1 binding sites in the promoter region of this gene .	false	Uncertain
E16	Negative_regulation	represses	positive_PromoterBinding__E2F1______MYC_E16	/tmp/positive_PromoterBinding__E2F1______MYC.txt	E2F1 transactivates c-Myb expression but represses c-Myc expression .	false	Certain
E17	Gene_expression	expression	positive_PromoterBinding__E2F1______MYC_E17	/tmp/positive_PromoterBinding__E2F1______MYC.txt	E2F1 transactivates c-Myb expression but represses c-Myc expression .	false	Certain
E1	Phosphorylation	phosphorylate	positive_ProtModification__JAK2______STAT1_E1	/tmp/positive_ProtModification__JAK2______STAT1.txt	positive ProtModification: JAK2 --+> STAT1 :  Relative to Jak2-WT, the ability of Jak2-Y372F to bind to and phosphorylate STAT1 was decreased, resulting in reduced Jak2-mediated downstream gene transcription.	false	Certain
E2	Positive_regulation	phosphorylates	positive_ProtModification__JAK2______STAT1_E2	/tmp/positive_ProtModification__JAK2______STAT1.txt	Interleukin-23 binding to an Interleukin-23 receptor expressed on dendritic cells, macrophages and monocytes triggers the activation of Jak2 and Tyk2, which in turn phosphorylates STAT1, STAT3, STAT4 and STAT5 as well as induce formation of STAT3-STAT4 heterodimers.	false	Certain
E4	Positive_regulation	regulated	positive_PromoterBinding__STAT5A______PAX5_E4	/tmp/positive_PromoterBinding__STAT5A______PAX5.txt	positive PromoterBinding: STAT5A --+> PAX5 :  PAX-5 is required for normal B-cell differentiation, and is regulated by STAT5 upon stimulation of early B-cells with the Early B-cell Factor .	false	Certain
E1	Positive_regulation	induce	positive_PromoterBinding__STAT5A______PAX5_E1	/tmp/positive_PromoterBinding__STAT5A______PAX5.txt	STAT5 then acts in synergy with Early, B cell factor to induce the expression of Pax5 .	false	Certain
E2	Positive_regulation	in	positive_PromoterBinding__STAT5A______PAX5_E2	/tmp/positive_PromoterBinding__STAT5A______PAX5.txt	EBF expression as well as expression of its targets, Pax5, Igα, and λ5, were restored in pre-pro-B cells in the presence of constitutive active STAT5.	false	Certain
E3	Positive_regulation	up-regulate	positive_PromoterBinding__STAT5A______PAX5_E3	/tmp/positive_PromoterBinding__STAT5A______PAX5.txt	Our results suggest that STAT5 phosphorylated by IL-7 can directly up-regulate Pax5 transcription in early B cells.	false	Uncertain
E1	Positive_regulation	stimulate	positive_ProtModification__MAPK8______FOS_E1	/tmp/positive_ProtModification__MAPK8______FOS.txt	positive ProtModification: MAPK8 --+> FOS :  MAP kinases including ERK, JNK and p38 can phosphorylate several transcription factors such as c-Jun and c-Fos, and then stimulate AP-1 activation.	false	Certain
E2	Activation	activation	positive_ProtModification__MAPK8______FOS_E2	/tmp/positive_ProtModification__MAPK8______FOS.txt	positive ProtModification: MAPK8 --+> FOS :  MAP kinases including ERK, JNK and p38 can phosphorylate several transcription factors such as c-Jun and c-Fos, and then stimulate AP-1 activation.	false	Certain
E12	Regulation	triggered	positive_MolTransport__BAX______CASP9_E12	/tmp/positive_MolTransport__BAX______CASP9.txt	positive MolTransport: BAX --+> CASP9 :  The adenine nucleotide translocator inhibitor bongkrekic acid prevented Bax and adenine nucleotide translocator interactions and inhibited Bax-triggered caspase-9 release from isolated brain mitochondria in vitro.	false	Certain
E2	Positive_regulation	leading	positive_MolTransport__BAX______CASP9_E2	/tmp/positive_MolTransport__BAX______CASP9.txt	In addition, Bax can heterodimerize with Bcl-2 or Bcl-x L, presumably also leading to the release of Apaf-1 and activation of caspase-9.	false	Certain
E3	Positive_regulation	induces	positive_MolTransport__BAX______CASP9_E3	/tmp/positive_MolTransport__BAX______CASP9.txt	Bax induces the release of both procaspase-9 (C, recombinant procaspase-9 served as positive control) and cytochrome c from the mitochondria, and bongkrekic acid inhibits the release of procaspase-9 but not cytochrome c. (b) Western blots showing the effects of bongkrekic acid on protein dimerization between Bax and adenine nucleotide translocator or voltage-dependent anion channel in isolated brain mitochondria.	false	Certain
E13	Regulation	triggered	positive_MolTransport__BAX______CASP9_E13	/tmp/positive_MolTransport__BAX______CASP9.txt	The adenine nucleotide translocator inhibitor bongkrekic acid, which interrupted Bax and adenine nucleotide translocator interactions and inhibited Bax-triggered caspase-9 release in vitro, showed significant protection against ischemia-induced caspase activation and cell death in the brain.	false	Certain
E4	Localization	release	positive_MolTransport__BAX______CASP9_E4	/tmp/positive_MolTransport__BAX______CASP9.txt	The adenine nucleotide translocator inhibitor bongkrekic acid, which interrupted Bax and adenine nucleotide translocator interactions and inhibited Bax-triggered caspase-9 release in vitro, showed significant protection against ischemia-induced caspase activation and cell death in the brain.	false	Certain
E5	Activation	activation	positive_MolTransport__BAX______CASP9_E5	/tmp/positive_MolTransport__BAX______CASP9.txt	Investigations of post-receptor signaling showed: caspase-8, Bid and Bax activation, increases in mitochondria permeability, cytochrome c release and caspase-9 activation.	false	Certain
E6	Positive_regulation	activation	positive_MolTransport__BAX______CASP9_E6	/tmp/positive_MolTransport__BAX______CASP9.txt	Investigations of post-receptor signaling showed: caspase-8, Bid and Bax activation, increases in mitochondria permeability, cytochrome c release and caspase-9 activation.	false	Certain
E11	Regulation	triggered	positive_MolTransport__BAX______CASP9_E11	/tmp/positive_MolTransport__BAX______CASP9.txt	The adenine nucleotide translocator inhibitor bongkrekic acid prevented Bax and adenine nucleotide translocator interactions and inhibited Bax-triggered caspase-9 release from isolated brain mitochondria in vitro.	false	Certain
E7	Positive_regulation	leading	positive_MolTransport__BAX______CASP9_E7	/tmp/positive_MolTransport__BAX______CASP9.txt	We show that calcium and Bax are responsible for the decrease in mitochondrial membrane potential (Deltapsi(m)), thereby leading to the release of cytochrome c and activation of caspase-9.	false	Certain
E8	Regulation	induced	positive_MolTransport__BAX______CASP9_E8	/tmp/positive_MolTransport__BAX______CASP9.txt	Pro-caspase-9 release from isolated mitochondria is induced by digitonin, Ca2+, or Bax.	false	Certain
E9	Activation	activation	positive_MolTransport__BAX______CASP9_E9	/tmp/positive_MolTransport__BAX______CASP9.txt	Upregulation of Bax expression by PRRSV infection was followed by disruption of the mitochondria transmembrane potential, resulting in cytochrome c redistridution to the cytoplasm and subsequent caspase-9 activation.	false	Certain
E10	Positive_regulation	activation	positive_MolTransport__BAX______CASP9_E10	/tmp/positive_MolTransport__BAX______CASP9.txt	Upregulation of Bax expression by PRRSV infection was followed by disruption of the mitochondria transmembrane potential, resulting in cytochrome c redistridution to the cytoplasm and subsequent caspase-9 activation.	false	Certain
E1	Regulation	activation	positive_MolTransport__BAX______CASP9_E1	/tmp/positive_MolTransport__BAX______CASP9.txt	Bax translocates to and permeabilizes the mitochondria, allowing the release of apoptogenic mediators and subsequent caspase-9 and caspase-3 activation, culminating in cardiomyocyte apoptosis..	false	Uncertain
E1	Binding	interacts	positive_DirectRegulation__SRC______PI3K_E1	/tmp/positive_DirectRegulation__SRC______PI3K.txt	positive DirectRegulation: SRC --+> PI3K :  Data from immunoprecipitation and immunoblotting assay reveal that Src interacts with c-Cbl and PI3K.	false	Certain
E1	Catalysis	ubiquitination	negative_ProtModification__MDM2______TP53_E1	/tmp/negative_ProtModification__MDM2______TP53.txt	negative ProtModification: MDM2 ---| TP53 :  Expression of Dmp1 antagonized ubiquitination of p53 by Mdm2 and promoted nuclear localization of p53.	false	Certain
E3	Ubiquitination	ubiquitination	negative_ProtModification__MDM2______TP53_E3	/tmp/negative_ProtModification__MDM2______TP53.txt	The model predicts existence of the HAUSP-regulated switch from auto- to p53 ubiquitination by Mdm2.	false	Certain
E4	Catalysis	catalyzed	negative_ProtModification__MDM2______TP53_E4	/tmp/negative_ProtModification__MDM2______TP53.txt	In vitro, p300 with MDM2 catalyzed p53 polyubiquitination, whereas MDM2 catalyzed p53 monoubiquitination.	false	Certain
E5	Ubiquitination	polyubiquitination	negative_ProtModification__MDM2______TP53_E5	/tmp/negative_ProtModification__MDM2______TP53.txt	In vitro, p300 with MDM2 catalyzed p53 polyubiquitination, whereas MDM2 catalyzed p53 monoubiquitination.	false	Certain
E6	Catalysis	catalyzed	negative_ProtModification__MDM2______TP53_E6	/tmp/negative_ProtModification__MDM2______TP53.txt	In vitro, p300 with MDM2 catalyzed p53 polyubiquitination, whereas MDM2 catalyzed p53 monoubiquitination.	false	Certain
E8	Ubiquitination	monoubiquitination	negative_ProtModification__MDM2______TP53_E8	/tmp/negative_ProtModification__MDM2______TP53.txt	In vitro, p300 with MDM2 catalyzed p53 polyubiquitination, whereas MDM2 catalyzed p53 monoubiquitination.	false	Certain
E9	Ubiquitination	ubiquitination	negative_ProtModification__MDM2______TP53_E9	/tmp/negative_ProtModification__MDM2______TP53.txt	Mitogenic signals activate p53 by induction of ARF expression, which inhibits p53 ubiquitination by MDM2.	false	Certain
E11	Catalysis	ubiquitination	negative_ProtModification__MDM2______TP53_E11	/tmp/negative_ProtModification__MDM2______TP53.txt	In addition to reactivating mutant p53, SCH529074 binding inhibits ubiquitination of p53 by HDM2.	false	Certain
E12	Ubiquitination	ubiquitylation	negative_ProtModification__MDM2______TP53_E12	/tmp/negative_ProtModification__MDM2______TP53.txt	In the present paper, we demonstrate that Sgk1 activates MDM2-dependent p53 ubiquitylation.	false	Certain
E7	Catalysis	dependent	negative_ProtModification__MDM2______TP53_E7	/tmp/negative_ProtModification__MDM2______TP53.txt	Pyk2 FERM promoted Mdm2-dependent p53 ubiquitination.	false	Certain
E2	Ubiquitination	ubiquitination	negative_ProtModification__MDM2______TP53_E2	/tmp/negative_ProtModification__MDM2______TP53.txt	Pyk2 FERM promoted Mdm2-dependent p53 ubiquitination.	false	Certain
E2	Positive_regulation	transactivate	positive_PromoterBinding__STAT5A______BCL2L1_E2	/tmp/positive_PromoterBinding__STAT5A______BCL2L1.txt	positive PromoterBinding: STAT5A --+> BCL2L1 :  STAT3 and STAT5a transcription factors become activated and translocate into the nucleus after CSF-1 stimulation (33) and have been shown to transactivate the bcl-x promoter (reviewed in Ref.34).	false	Certain
E1	Regulation	repression	positive_PromoterBinding__STAT5A______BCL2L1_E1	/tmp/positive_PromoterBinding__STAT5A______BCL2L1.txt	Rather, our data support a model in which ToxB-induced Rac inhibition in cerebellar granule neurons activates a novel proapoptotic Janus kinase/signal transducer and activator of transcription5 pathway that, following STAT5A phosphorylation and translocation to the nucleus, results in the transcriptional repression of prosurvival Bcl-xL and subsequent activation of caspase-3 and apoptosis.	false	Certain
E1	Negative_regulation	level	positive_Expression__Cytoxan______TP53_E1	/tmp/positive_Expression__Cytoxan______TP53.txt	positive Expression: Cytoxan --+> TP53 :  Cyclophosphamide treatment led to significant increase in p38 and p53 level as compared to control.	false	Certain
E1	Positive_regulation	activate	positive_ProtModification__RAF1______MAP2K2_E1	/tmp/positive_ProtModification__RAF1______MAP2K2.txt	positive ProtModification: RAF1 --+> MAP2K2 :  Interestingly, A-Raf does not activate MEK2, although c-Raf can activate both MEK1 and MEK2.	false	Certain
